{
  "schema_version": 1,
  "request_id": "req-routing-fixtures",
  "ok": true,
  "result": {
    "tasks": [
      {
        "ref": {
          "backend_kind": "test-memory",
          "remote_id": "route-1",
          "key": "ROUTE-1",
          "url": "https://tracker.example/tasks/ROUTE-1"
        },
        "title": "Routing primary",
        "description": "Routing fixture task",
        "priority": 2,
        "state": {
          "id": "todo",
          "name": "Todo",
          "category": "ready"
        },
        "branch_hint": "route-1-fake",
        "labels": [
          { "id": null, "name": "workflow:execplan" },
          { "id": null, "name": "team:core" }
        ],
        "blockers": [
          {
            "backend_kind": "test-memory",
            "remote_id": "route-2",
            "key": "ROUTE-2",
            "url": "https://tracker.example/tasks/ROUTE-2"
          }
        ],
        "blockers_complete": false,
        "created_at": null,
        "updated_at": null
      },
      {
        "ref": {
          "backend_kind": "test-memory",
          "remote_id": "route-2",
          "key": "ROUTE-2",
          "url": "https://tracker.example/tasks/ROUTE-2"
        },
        "title": "Routing blocker",
        "description": "Routing blocker fixture task",
        "priority": 1,
        "state": {
          "id": "doing",
          "name": "Doing",
          "category": "active"
        },
        "branch_hint": "route-2-fake",
        "labels": [
          { "id": null, "name": "workflow:execplan" }
        ],
        "blockers": [],
        "blockers_complete": true,
        "created_at": null,
        "updated_at": null
      }
    ]
  }
}
